{
  "schema_version": "1.0.0",
  "video": {
    "source_type": "upload",
    "source": "smoke_test.mp4",
    "title": "Smoke Test Video",
    "duration_ms": 6000,
    "language": "en"
  },
  "entities": {
    "speakers": [
      {
        "id": "narrator",
        "label": "Narrator"
      }
    ]
  },
  "segments": [
    {
      "id": "s01",
      "start_ms": 0,
      "end_ms": 3000,
      "type": "intro",
      "speaker_id": "narrator",
      "summary": "Smoke test segment 1"
    },
    {
      "id": "s02",
      "start_ms": 3000,
      "end_ms": 6000,
      "type": "outro",
      "speaker_id": "narrator",
      "summary": "Smoke test segment 2"
    }
  ]
}
